{
  "id": "9d36630209",
  "date": "2026-08-20",
  "title": "热心市民“多管闲事”，竟为多名群众保住近30万元",
  "source": "sichuan.scol.com.cn",
  "url": "https://sichuan.scol.com.cn/ggxw/202608/83308492.html",
  "pubDate": "",
  "fetchedAt": "2026-08-20T22:26:05+00:00",
  "status": "ok",
  "paragraphs": [
    "因为一次“多管闲事”，成都市民孔先生帮人拦下了2万多元。凭借这股爱“多管闲事”的劲儿，他本月以来已先后协助警方劝阻了4起类似的“现金交付”骗局，帮多名群众保住了近30万元。",
    "孔先生的第一次劝阻，是在8月3日下午，成都武侯金花桥辖区某汽修厂，作为汽修厂负责人的孔先生发现一男子在汽修厂拍照，手里也没拿任何东西，这一举动引起了他的警觉，“为啥要到汽修厂拍照，这又不是网红打卡点。”",
    "后来，这名男子走出汽修厂，“在他出厂时，我就感觉这个人行踪诡异，并且还在不停用手机发消息，难道是在告诉受害人，他已到达指定地点？”于是，孔先生紧随其后，看他到底要干啥。",
    "果然，不一会儿，一辆网约车停在了汽修厂门口，一名戴着口罩的男子下车，背着包，神色慌张，不停地翻看手机。",
    "这时，孔先生的脑海里立马拉响警报，“可能这个人遇到诈骗了，这是来交钱的，而拍照的男子就是来拿钱的。”",
    "想到这里，他立即报了警，并且上前将两人的手拉住，将两人拉到旁边的一间仓库里。",
    "不一会儿，在附近巡逻的辅警魏来抵达现场，初步确认戴口罩的男子黄某被骗；随后民警梁满伟带队赶到，进一步确认当事人黄某正深陷“网络交友+数据修复”骗局，准备将现金送至骗子的指定地点，好在被孔先生牢牢稳住，这才避免了25000元的现金损失。",
    "为感谢这位“反诈义士”，8月5日，金花桥派出所所长王杨专门带着反诈民警，上门为孔先生颁发荣誉证书和群防群治奖励金。",
    "这不是一次简单的表彰，而是警民携手反诈的生动体现——孔先生的“多管闲事”，背后是警方日复一日的反诈浸润。",
    "受到表扬的孔先生并未停下脚步。在半个月时间内，他多次主动配合警方，已协助拦截了4起“现金交付”骗局，警民合力为群众挽回损失近30万元。从一个人到一群人，从一次出手到次次响应，孔先生成了社区里有名的“反诈哨兵”。",
    "警方提醒：警惕电信网络诈骗，切勿线下进行现金、黄金交易，谨防财产受损。遇可疑情况，请及时拨打110报警。"
  ],
  "keySentences": [],
  "aiModel": "deepseek-chat",
  "aiPromptVersion": "article-analysis-v1",
  "aiGeneratedAt": "2026-08-20T22:26:06+00:00",
  "sourceTextHash": "0ca3fa46a19b3da3dc2a0cfc08aa0c0ae3c0e5d1de07af801d1291b2dc233edc",
  "aiStatus": "ok",
  "aiSummary": "成都市民孔先生因一次“多管闲事”协助警方劝阻“现金交付”骗局，本月以来已成功拦截4起诈骗，为群众保住近30万元。警方上门表彰，警民携手反诈，孔先生成为社区“反诈哨兵”。",
  "aiAnnotations": [
    {
      "id": "ai-0-0-28-viewpoint",
      "paragraphIndex": 0,
      "start": 0,
      "end": 28,
      "text": "因为一次“多管闲事”，成都市民孔先生帮人拦下了2万多元。",
      "type": "viewpoint"
    },
    {
      "id": "ai-8-0-52-viewpoint",
      "paragraphIndex": 8,
      "start": 0,
      "end": 52,
      "text": "这不是一次简单的表彰，而是警民携手反诈的生动体现——孔先生的“多管闲事”，背后是警方日复一日的反诈浸润。",
      "type": "viewpoint"
    },
    {
      "id": "ai-9-67-105-viewpoint",
      "paragraphIndex": 9,
      "start": 67,
      "end": 105,
      "text": "从一个人到一群人，从一次出手到次次响应，孔先生成了社区里有名的“反诈哨兵”。",
      "type": "viewpoint"
    },
    {
      "id": "ai-0-64-68-term",
      "paragraphIndex": 0,
      "start": 64,
      "end": 68,
      "text": "现金交付",
      "type": "term",
      "explanation": "指诈骗分子诱导受害人将现金直接交给指定人员或放置于指定地点的诈骗手法。"
    },
    {
      "id": "ai-6-61-70-term",
      "paragraphIndex": 6,
      "start": 61,
      "end": 70,
      "text": "网络交友+数据修复",
      "type": "term",
      "explanation": "一种电信网络诈骗套路，骗子以交友为名诱导受害人投资或修复数据，进而骗取钱财。"
    },
    {
      "id": "ai-4-18-49-exam_point",
      "paragraphIndex": 4,
      "start": 18,
      "end": 49,
      "text": "可能这个人遇到诈骗了，这是来交钱的，而拍照的男子就是来拿钱的。",
      "type": "exam_point"
    },
    {
      "id": "ai-6-20-34-exam_point",
      "paragraphIndex": 6,
      "start": 20,
      "end": 34,
      "text": "初步确认戴口罩的男子黄某被骗",
      "type": "exam_point"
    },
    {
      "id": "ai-7-0-57-exam_point",
      "paragraphIndex": 7,
      "start": 0,
      "end": 57,
      "text": "为感谢这位“反诈义士”，8月5日，金花桥派出所所长王杨专门带着反诈民警，上门为孔先生颁发荣誉证书和群防群治奖励金。",
      "type": "exam_point"
    },
    {
      "id": "ai-9-15-67-exam_point",
      "paragraphIndex": 9,
      "start": 15,
      "end": 67,
      "text": "在半个月时间内，他多次主动配合警方，已协助拦截了4起“现金交付”骗局，警民合力为群众挽回损失近30万元。",
      "type": "exam_point"
    },
    {
      "id": "ai-10-0-52-exam_point",
      "paragraphIndex": 10,
      "start": 0,
      "end": 52,
      "text": "警方提醒：警惕电信网络诈骗，切勿线下进行现金、黄金交易，谨防财产受损。遇可疑情况，请及时拨打110报警。",
      "type": "exam_point"
    }
  ],
  "aiQuality": {
    "locationErrors": 0
  }
}