{
  "id": "875c844877",
  "date": "2026-08-13",
  "title": "“手洗一辆车”也能让情绪压力清零？",
  "source": "半月谈",
  "url": "http://www.banyuetan.org/jrt/detail/20260813/1000200033134991786585066538220531_1.html",
  "pubDate": "",
  "fetchedAt": "2026-08-13T22:17:18+00:00",
  "status": "ok",
  "paragraphs": [
    "自助手洗、无人值守、24小时开放……数据显示：2023年至2026年，全国自助洗车网点数量年均增速为35%。遍地开花的自助洗车房如同一阵风，吹进了年轻人的心窝。当“健身卡”换成了“洗车卡”，洗车正在为年轻人打开解压新天地。",
    "“21点到22点洗车位有空余，想来洗车的报名，仅限2名。”北京白领钱超看到洗车房老板在群里发的通知，立刻兴奋地接龙报名。刚点下确认，两个洗车位已经“秒没”。",
    "自助洗车房位于一座公寓地下二层停车场。晚上9点，6个洗车位全部被占用。一片灯火通明中，高压喷枪、抹布、车刷、泡沫枪在车主的手里来回轮转，几乎没有人讲话。钱超的车非常脏，他扫码连上计时水枪后，冲洗、打沫，连轮毂里的一点泥巴，都用软毛刷蹭得干干净净。",
    "一小时马不停蹄地弯腰冲洗、数十次蹲起，终于将自己的轿车洗得晶晶闪亮，车内散发着淡淡香气。“今天可以睡个好觉了”，此时的钱超内心十分满足。",
    "有车族洗自己的车，无车族借别人的车来洗，甚至将摩托车、自行车统统搬来清洗。继“撸猫”“撸狗”之后，“撸车”成为年轻人的新型解压神器。",
    "年轻人在职场、学业、生活中的付出，大多属于长线付出，尤其职场年轻人，工作业绩很难立刻看到成果。而洗车有着极强的可视化变化：满是泥污的车身，从铺满泡沫到清水冲净，再到漆面光亮，短时间内就能完整见证“由脏变净”的蜕变。这一过程会促进身体快速分泌多巴胺，抵消挫败感，心理学称之为“洁净重置效应”——清理污物就像梳理心灵，给情绪“洗澡”。",
    "自助洗车从冲水、打泡沫、刷轮毂到吸尘，全由自己说了算，缝隙、死角的掌控权都在自己手里。相比于在职场中处处被规则、甲方、合同所约束，“手洗一辆车”是年轻人全程自主、彻底摆脱被动的重要小事。",
    "对很多脑力劳动者而言，安静的夜晚，一人一车，反复冲水、擦拭、擦干……这一系列单调的机械动作，反而让大脑脱离繁杂思绪进入“留白状态”；水枪持续的水流声，隔绝了工作消息、社交琐事，实现短暂精神抽离。很多疲于社交的人士选择深夜洗车，独享无人打扰的私密空间，尽管体力消耗颇多，但精神收获丰富。",
    "在心理学上，触觉刺激是一种温和的情绪出口。当工作学业令人压抑、烦躁时，水枪用力冲刷污渍的同时，焦虑、闷气仿佛顺着水流被一并带走。泡沫的顺滑触感、清洁剂的清新气味、车漆锃亮的视觉……多重感官共同舒缓压力，这种感觉会令人上瘾。",
    "对年轻人而言，自助洗车房是社交场景转换的产物，更适配当代生活节奏。谁没有在传统洗车店被推销办卡的尴尬瞬间呢？而24小时自助洗车大多无人值守，不用沟通寒暄，不用应付店员推销，想洗多久就洗多久。如此零社交负担的独处空间，很难不吸引年轻人。",
    "“手洗一辆车”，既可以是疲于社交人士的避风港，也可以成为兴趣社交的沟通桥梁。“过去总是相约啤酒烧烤，现在相约‘撸车’。”车主“麦克杨”说，“带着各自精心调配的清洁剂，痛痛快快出一次汗，这种‘活人感’的体验非常美妙。”",
    "相比其他解压爱好，自助洗车水费每分钟仅需0.8元，小区、地下车库随处可见网点，午休、晚饭后、雨天后都能随时操作，不用提前规划，碎片时间里就能完成一次情绪释放。泡沫冲刷、泥沙滑落的画面，是年轻人追求洁净、释放压力的具体实践。掌控生命的律动，找回内心秩序，不妨从认真洗一辆车开始。"
  ],
  "keySentences": []
}