{
  "id": "fd6c6c9dda",
  "date": "2026-08-13",
  "title": "35公里外拍到广州塔，广东空气优良天数比率持续提升",
  "source": "news.dayoo.com",
  "url": "https://news.dayoo.com/guangdong/202608/13/139996_54990586.htm",
  "pubDate": "",
  "fetchedAt": "2026-08-13T22:03:53+00:00",
  "status": "ok",
  "paragraphs": [
    "8月13日下午，广东省人民政府新闻办公室举行2026年上半年广东省生态环境质量状况新闻发布会。省生态环境厅副厅长周国英通报全省生态环境质量总体情况时，特意拿出一张照片：近日一位摄影爱好者在东莞市洪梅镇用长焦镜头捕捉到35公里外的广州塔，“这种‘清澈对望’，正是我省空气环境质量不断提升的‘生动见证’。”周国英说。",
    "而这帧镜头里的通透感，即将接受更高规格的检验——APEC第三十三次领导人非正式会议将于今年11月在深圳举行，广东将以此次会议的空气质量保障工作为契机，持续提升全省环境质量。",
    "2026年1—6月，广东生态环境质量“成绩单”由一组硬核数据托底：水、气两项主指标双双跑赢全国均线，公众肉眼可见的远眺清晰度与监测站点里的微克数形成互证。",
    "周国英介绍，今年以来广东以绿美广东生态建设为牵引推进美丽中国先行区建设，1—6月全省生态环境质量保持稳中向好：125个纳入国家考核的地表水断面中，达到或好于Ⅲ类水质比例88.8%，同比提升1.6个百分点，高于全国平均水平1.4个百分点；县级以上在用饮用水源地水质全部达标。空气方面，全省优良天数比率（AQI）95.8%，同比改善3.1个百分点，高于全国平均水平13个百分点；PM2.5浓度21微克/立方米，同比改善7.5%，比全国平均水平低8.9微克/立方米。",
    "近日，一位摄影爱好者在东莞定格广州塔风景。广东省生态环境厅供图",
    "稳中向好的曲线，来自五条并行推进的工作线。上半年广东生态环境保护重点推进五方面工作。",
    "全面开启美丽建设——《粤港澳大湾区美丽中国先行区建设行动方案》2026年工作清单落地，广州探路区域性环保投融资，深圳打造“六大标杆”，珠海建三级“宁静体系”；8个河湖、4个海湾入选全国美丽河湖海湾优秀案例，34个县（市、区）整县建成美丽乡村，龙门县入选首批全国美丽乡村先行区。",
    "深入推进环境治理——钢铁、水泥超低排放改造与VOCs治理并行，533条地级市、41条县级市黑臭水体全面消除；固废专项整治查处非法倾倒约2000宗、清理107万吨，522个溶洞排查动态清零。",
    "服务推动绿色发展——出台制造业与服务业协同融合“十条”，环评“即来即办、容缺受理”，上半年审批建设项目环评6238个；培育超1万个“无废”绿色主体，发布32项碳足迹核算团体标准推荐清单，发放广东碳标签证书226张。",
    "积极推进法治建设——以8月15日施行的《中华人民共和国生态环境法典》为契机清理地方性法规，上半年查办违法案件2800多宗；第三轮中央督察交办5836件举报已办结或阶段性办结5117件，省委、省政府6月印发《广东省生态环境综合整治提升行动方案》统筹六大提升行动。",
    "全面推进公众参与——粤港澳三地政府联合成功举办六五环境日国家主场活动。省生态环境厅联合省委宣传部印发“媒体+”赋能粤港澳大湾区美丽中国先行区建设行动方案；联合省委社会工作部指导推进全省生态环境志愿服务有效开展，联合省妇联持续开展“绿色生活我当家”系列宣传教育活动，营造保护环境的良好社会氛围。",
    "第十五届全国运动会期间的“全运蓝”令人惊艳，2026年亚太经合组织（APEC）第三十三次领导人非正式会议将于11月在深圳举行，广东将如何做好会议期间的空气质量保障工作？",
    "对此，广东省生态环境厅大气环境处处长张瑞凤介绍，APEC会议期间空气质量保障联防联控工作聚焦三大方面：",
    "一是精准开展空气质量监测和预报。建立完善监测、会商、预报组织体系，梳理核心管控城市（深圳）空气质量监测资料，分析历史同期污染案例、污染来源与成因，提升监测预报的针对性。依托AI算法、高精度排放清单，持续开展大气常规与成分监测、移动监测、遥感监测，提升监测预报的精准性。",
    "二是科学开展大气污染源精细化减排。以深圳市为核心管控城市，广州、佛山、珠海、中山、东莞、惠州、汕尾、汕头、揭阳9市为重点管控城市，全省其他城市为协同管控城市，加快推进2026年度大气污染防治重点治理措施落地见效，从源头压减污染物存量。在“美丽全运”空气质量管控清单基础上，进一步补充污染物排放量大的污染源、细化管控措施，细化一企一策差异化管控清单，夯实污染减排基础。",
    "三是联合港澳和周边省份深化跨区域联防联控。主动对接福建、江西、湖南、广西等周边省（自治区）及港澳地区，联动开展会期监测预警和协同治污，共同加强污染源管控，重点指导传输通道上的城市强化对钢铁、水泥等高架源企业排放监管，严格监管秸秆和露天焚烧，切实减少大气污染传输影响。",
    "美丽中国湾区先行，美丽广东共建共享。省生态环境厅表示，接下来，将以《中华人民共和国生态环境法典》实施和深圳APEC会议环境质量保障为契机，继续锚定“走在前列”总目标，立足为美丽中国建设作示范、为高质量发展塑优势、为社会民生增福祉，全力推进生态环境保护和美丽广东建设取得新进展。"
  ],
  "keySentences": []
}