{
  "id": "9322434b0d",
  "date": "2026-08-21",
  "title": "从“枪林弹雨”到“深山守坝”：大渡河畔跨越91年的青春接力丨C视频",
  "source": "sichuan.scol.com.cn",
  "url": "https://sichuan.scol.com.cn/ggxw/202608/83309140.html",
  "pubDate": "",
  "fetchedAt": "2026-08-21T22:25:19+00:00",
  "status": "ok",
  "paragraphs": [
    "8月19日，武警部队“英雄路·新长征”宣传教育文化活动走进武警四川总队雅安支队。官兵们来到中国工农红军强渡大渡河纪念馆，聆听91年前那段气壮山河的英雄史诗。",
    "“我们现在所在的位置，就是当年红军强渡大渡河的口岸——红星（军）渡。我还记得爷爷常说，当时河水里都飘着火药味。”红军强渡大渡河船工帅仕高的孙子帅飞，凝视着奔涌的大渡河说道。1935年5月，红军抵达安顺场，在马鞍山设临时营地。“爷爷会撑船，得知红军要渡河主动提出可以帮忙，便和其他7名船工加入渡河行动。”",
    "当时大渡河300多米宽、30多米深，旋涡密布、暗礁丛生。帅飞说：“渡河当天水流湍急，船只数次被冲向险滩。关键时刻，4名船工跳下水抵住船身，拼命划桨，在枪林弹雨中为红军打开生命通道。”帅仕高作为主舵手，在船卡在礁石上的危急时刻，和另一名船工直接跳入河中，用双臂奋力推开船只。此后，帅仕高继续留在船工队伍，和77名船工一起用七天七夜护送红军渡河。",
    "新中国成立后，帅仕高被评为“爱国拥军新闻人物特别奖”。“这不仅是爷爷的荣誉，更是军民鱼水情的见证。”帅飞受爷爷的鼓舞，高中毕业后参军入伍，退役后回到安顺场镇安顺村，成为“勇士突击队”成员。2022年“9·5”泸定地震发生后，他带领14名队员穿越多个塌方点，徒步挺进“孤岛”救援，“我的身上流的是爷爷的血，骨头里长着他的硬气，我会永远铭记爷爷的教诲，把红色精神传承下去。”他坚定地说。",
    "91年后，武警雅安支队执勤四中队官兵驻守在大渡河中游上段的大岗山水电站——一座最大坝高210米、总库容7.42亿立方米的“大国重器”。中队指导员陈星宇介绍说，“大渡河流经多个城区，大坝的安全关乎数百万群众的安危。”为确保不出问题，中队分3个营区守卫着关键节点，日复一日查验车辆人员、巡逻排查隐患。",
    "“大岗山地质结构复杂，是地震、山洪、泥石流等自然灾害高发区域，坝区周边山势险峻、路况崎岖。作为大岗山的守坝兵，官兵们还要克服潮湿环境造成的困扰。”陈星宇说，为了让新兵尽快适应，下队第一课就是走进纪念馆重温历史。在“十七勇士”的浮雕前重温那段惊心动魄的历史；组成创作小组，从史料梳理到笔墨勾勒，绘制《夜袭安顺场》《强渡大渡河》《翻越夹金山》等红色漫画集；自导自演情景课《红军长征在雅安：强渡大渡河·翻越夹金山》，在打磨剧本的过程中追寻先辈的英雄足迹。",
    "2022年“9·5”泸定地震，中队党员突击队徒步行军17小时挺进孤岛，奋战20余天，救出伤员50余人、转移群众千余人。建队以来，中队先后被评为“四铁”先进单位，2次荣立集体三等功。"
  ],
  "keySentences": [],
  "aiModel": "deepseek-chat",
  "aiPromptVersion": "article-analysis-v1",
  "aiGeneratedAt": "2026-08-21T22:25:20+00:00",
  "sourceTextHash": "0dce51819542c4aa69404c64c8b138158e22c3b40da78fff112a570e2f41aace",
  "aiStatus": "ok",
  "aiSummary": "从1935年红军强渡大渡河到2024年武警守坝，跨越91年，红色精神在帅飞等后人及武警官兵中传承，军民鱼水情与守护大坝安全的使命交织，彰显新时代长征精神的延续。",
  "aiAnnotations": [
    {
      "id": "ai-0-60-77-viewpoint",
      "paragraphIndex": 0,
      "start": 60,
      "end": 77,
      "text": "聆听91年前那段气壮山河的英雄史诗",
      "type": "viewpoint"
    },
    {
      "id": "ai-1-119-134-viewpoint",
      "paragraphIndex": 1,
      "start": 119,
      "end": 134,
      "text": "得知红军要渡河主动提出可以帮忙",
      "type": "viewpoint"
    },
    {
      "id": "ai-2-74-89-viewpoint",
      "paragraphIndex": 2,
      "start": 74,
      "end": 89,
      "text": "在枪林弹雨中为红军打开生命通道",
      "type": "viewpoint"
    },
    {
      "id": "ai-3-174-183-viewpoint",
      "paragraphIndex": 3,
      "start": 174,
      "end": 183,
      "text": "把红色精神传承下去",
      "type": "viewpoint"
    },
    {
      "id": "ai-0-45-59-term",
      "paragraphIndex": 0,
      "start": 45,
      "end": 59,
      "text": "中国工农红军强渡大渡河纪念馆",
      "type": "term",
      "explanation": "为纪念红军强渡大渡河而建立的纪念馆，位于四川石棉县安顺场，是爱国主义教育基地。"
    },
    {
      "id": "ai-1-86-93-exam_point",
      "paragraphIndex": 1,
      "start": 86,
      "end": 93,
      "text": "1935年5月",
      "type": "exam_point"
    },
    {
      "id": "ai-2-160-164-exam_point",
      "paragraphIndex": 2,
      "start": 160,
      "end": 164,
      "text": "七天七夜",
      "type": "exam_point"
    },
    {
      "id": "ai-3-94-108-exam_point",
      "paragraphIndex": 3,
      "start": 94,
      "end": 108,
      "text": "2022年“9·5”泸定地震",
      "type": "exam_point"
    },
    {
      "id": "ai-4-29-35-term",
      "paragraphIndex": 4,
      "start": 29,
      "end": 35,
      "text": "大岗山水电站",
      "type": "term",
      "explanation": "位于大渡河中游的大型水电站，最大坝高210米，总库容7.42亿立方米，是重要基础设施。"
    },
    {
      "id": "ai-5-155-162-exam_point",
      "paragraphIndex": 5,
      "start": 155,
      "end": 162,
      "text": "《强渡大渡河》",
      "type": "exam_point"
    },
    {
      "id": "ai-6-17-22-term",
      "paragraphIndex": 6,
      "start": 17,
      "end": 22,
      "text": "党员突击队",
      "type": "term",
      "explanation": "由党员组成的先锋队伍，在急难险重任务中发挥模范带头作用，常用于抢险救灾。"
    }
  ],
  "aiQuality": {
    "locationErrors": 0
  }
}