{
  "id": "6905f67b00",
  "date": "2026-08-19",
  "title": "“宁静住宅”是奢侈吗",
  "source": "半月谈",
  "url": "http://www.banyuetan.org/jrt/detail/20260819/1000200033134991787102725851289398_1.html",
  "pubDate": "",
  "fetchedAt": "2026-08-19T22:24:18+00:00",
  "status": "ok",
  "paragraphs": [
    "从原始的“遮蔽物”到今天的“住宅”，随着文明进步，人类对居住的需求不断提升。城市一栋楼，装下郊区一个村。大型城市住宅的密度之大令人惊叹，建筑物隔音不足带来的纠纷矛盾比比皆是。降低噪声干扰成为提高居民居住质量的重要指标之一。",
    "建筑构件隔声能力不足导致的噪声往往让人无法接受，因为这样的噪声干扰是全天候的，即使是邻居正常生活产生的声音，例如电话声、电视、交谈甚至马桶排水等也会造成干扰。",
    "我国有大量老旧建筑房屋，老旧小区的建造标准过低导致建筑构件隔音性能不足十分明显。",
    "老旧小区一般是指2000年之前建设的住宅小区，当时执行的主要标准还是《城市区域环境噪声标准》（GB3096-93）以及《民用建筑隔声设计规范》（GBJ118-88）。彼时的城市处在快速发展时期，部分住宅尤其是异地拆迁安置的住房选址距离噪声源比较近，建筑构件仅满足基本规范要求，甚至为追求结构安全与面积最大化而忽略隔声功能。",
    "有些住宅为了节约造价尽量扩大房间内使用面积，分户墙采用隔声能力不足的轻体墙，甚至有些隔断墙不能严格从地面到顶面完全密实，出现两户间能隔墙聊天的窘况。还有些高层住宅的部分起居室毗邻电梯井道，未做双层墙隔声措施，导致电梯井道噪声传入室内。",
    "随着新的国家标准和规范出台，新建住宅建筑构件的隔声能力有了明显改善和提升，但建筑构件隔声能力不足的问题依然突出。",
    "首先，我们国家制定的国标是对最低标准的限定。建筑的设计建造符合这个标准即为达标，但居民生活标准高了，对低噪声的期望也就更高。",
    "其次，建筑施工工艺与精细度还有不足。例如在新建住宅中，装配式建筑占有一定比例。市场上装配式住宅主要分为装配式混凝土PC住宅（大部分商品房的主流）和装配式钢结构住宅（大部分保障房或集中公寓的主流）。在2025年的“好房子”标准出台之前，装配式混凝土PC住宅中的分户墙主要是采用200厚预制实心混凝土分户墙或150mm厚蒸压加气混凝土条板，其基础空气声隔声量基本能满足当时规范要求。楼板常用预制加现浇面层的叠合楼板，能达到撞击声隔绝基本标准。",
    "而装配式钢结构住宅大多采用轻钢龙骨双层石膏板，中间空腔填充岩棉或玻璃棉的隔墙，构件空气声隔声量实验室数据满足基本规范要求，但是板材有拼缝，龙骨形成声桥，如果施工不精细、缝隙阻断不够、龙骨安装未充分设置弹性垫层，其实际隔声量就会下降不少。当楼上制造的撞击噪声较大时，楼下就不堪重负了。",
    "近年来，住宅中设备增加且集约化带来了更多噪声，例如家用中央空调室外机可能对房间有影响。某高级公寓式小区采用地源热泵的方式供暖，由于其机房位于地下夹层，缺少足够空间进行隔离，而且大量管道穿墙，导致机器运行时产生的低频噪声影响从1层到6层同一位置的多户卧室。",
    "看到这里，你会认为距离安静越来越远了？其实不然，安静“好房子”正在路上。",
    "实际上，为了让安静住所早日普及，社会各个领域已经开始努力了。",
    "许多城市更新不再采用大拆大建，而是城市区域功能整合与整体环境提升。工业、商业等区域的调整和更新，使得噪声从源头上降低甚至消灭。城市微更新在不断推进、口袋公园不断建设、小区绿化面积不断提升以及新建道路隔声屏障的普及，有效在噪声传播路径上增加了声音能量的吸收和衰减。",
    "从投放到市场的住宅产品入手，从规划到建筑设计对住宅的声环境性能进行规定，是确保住宅更安静的基础。",
    "2025年颁布实施的《住宅项目规范》（GB55038-2025）对住宅建筑设计提出了明确的标准，对住宅外门、外窗、分户墙、楼板等都提出更严格的要求，对设备噪声水平也进行了规定。这些看似仅是一些数值的限定，但会直接推动住宅内部空间的布局优化、建筑材料与构件产品隔声性能提升、建筑构造细节施工质量加强保障。所以，在该规范实施之后设计建造的“好房子”将越来越“安静”。",
    "在该规范出台之前，2023年9月实施的中国城市科学研究会标准（团体标准）《宁静住宅评价标准》（T/CSUS61-2023）从场地噪声与振动、规划与建筑降噪、室内噪声与振动、空气声隔声、撞击声隔声、制度与管理6类指标对住宅进行了综合评价，将宁静住宅分为铜级、银级、金级和铂金级。这一标准虽不属于国家强制性条文，但在房地产住宅产品日益精致的趋势下，将极大促进居住环境更加安静。",
    "在新规的要求下，设计理念和产品技术已经开始不断提升。在建筑构件隔声性能上，要满足新规的要求，部分传统的构造需要优化。住宅分户墙增加了厚度，或采用了增加阻尼材料的多层复合墙体。",
    "目前，众多隔声构件生产企业以及设计企业在提升隔声能力方面作出了许多努力，并付诸实践。例如，贝壳集团旗下贝好家贝宸S1项目团队从规划设计方案之初，便将“隔声降噪”作为核心考量，针对外界噪声、户间传声和设备运行噪声等三大类噪音源头，进行系统化的全维隔声降噪。",
    "上下楼板隔音能力不足最容易引发邻里矛盾。解决这一难题的有效做法是在结构楼板上铺设隔音垫。这种隔音垫由聚氨酯和其他高密度材料制成，能有效吸收声音，减少楼层间的撞击与振动噪音。",
    "这种材料在楼板间大面积铺设，会显著增加成本，但为追求更好的层间隔音效果，贝宸S1进一步提升设计标准，在除盥洗室和厨房以外的所有区域均铺设10mm厚的聚氨酯隔音垫。",
    "对既有住宅而言，理论上，由于基础条件限制，隔声处理改造难度不小。分户墙的隔声能力虽然可以通过增加墙体厚度来改善，但代价是减少了户内使用面积。由于层高的限制，无法再做效果较好的浮筑楼面。然而事实是，从事二手房隔音改造的企业越来越多，轻薄、低成本、新材料隔音改造研发成果涌现，改造效果不断进步。面向既有住宅隔声能力改造的产业，会有更广阔的市场预期。",
    "虽然目前的住宅声环境还有很多不如人意的地方，但可喜的是随着规范政策不断完善、社会治理不断深化、建造技术不断优化，我们能看到安静的“好房子”正在赶来的路上，拥有宁静的居住空间并不是梦想。（作者系北方工业大学建筑与艺术学院建筑系主任）"
  ],
  "keySentences": [],
  "aiModel": "deepseek-chat",
  "aiPromptVersion": "article-analysis-v1",
  "aiGeneratedAt": "2026-08-19T22:24:19+00:00",
  "sourceTextHash": "2b0eb6184be936183bade45e278c22995168e6d44a3e6e6f6ef9cb065b618cac",
  "aiStatus": "ok",
  "aiSummary": "文章探讨住宅隔音问题，指出老旧建筑标准低、新建住宅施工不足及设备噪声等现状，同时介绍新国标和团体标准推动“好房子”建设，通过技术改进和产业努力，宁静住宅正逐步实现。",
  "aiAnnotations": [
    {
      "id": "ai-0-87-110-viewpoint",
      "paragraphIndex": 0,
      "start": 87,
      "end": 110,
      "text": "降低噪声干扰成为提高居民居住质量的重要指标之一",
      "type": "viewpoint"
    },
    {
      "id": "ai-5-0-55-viewpoint",
      "paragraphIndex": 5,
      "start": 0,
      "end": 55,
      "text": "随着新的国家标准和规范出台，新建住宅建筑构件的隔声能力有了明显改善和提升，但建筑构件隔声能力不足的问题依然突出",
      "type": "viewpoint"
    },
    {
      "id": "ai-10-24-35-viewpoint",
      "paragraphIndex": 10,
      "start": 24,
      "end": 35,
      "text": "安静“好房子”正在路上",
      "type": "viewpoint"
    },
    {
      "id": "ai-14-0-47-exam_point",
      "paragraphIndex": 14,
      "start": 0,
      "end": 47,
      "text": "2025年颁布实施的《住宅项目规范》（GB55038-2025）对住宅建筑设计提出了明确的标准",
      "type": "exam_point"
    },
    {
      "id": "ai-15-36-61-exam_point",
      "paragraphIndex": 15,
      "start": 36,
      "end": 61,
      "text": "《宁静住宅评价标准》（T/CSUS61-2023）",
      "type": "exam_point"
    },
    {
      "id": "ai-3-34-57-exam_point",
      "paragraphIndex": 3,
      "start": 34,
      "end": 57,
      "text": "《城市区域环境噪声标准》（GB3096-93）",
      "type": "exam_point"
    },
    {
      "id": "ai-3-59-82-exam_point",
      "paragraphIndex": 3,
      "start": 59,
      "end": 82,
      "text": "《民用建筑隔声设计规范》（GBJ118-88）",
      "type": "exam_point"
    },
    {
      "id": "ai-7-73-81-term",
      "paragraphIndex": 7,
      "start": 73,
      "end": 81,
      "text": "装配式钢结构住宅",
      "type": "term",
      "explanation": "以钢结构为骨架、轻质墙板围护的装配式住宅，多用于保障房或公寓。"
    },
    {
      "id": "ai-19-74-80-term",
      "paragraphIndex": 19,
      "start": 74,
      "end": 80,
      "text": "聚氨酯隔音垫",
      "type": "term",
      "explanation": "由聚氨酯等高密度材料制成，铺设于楼板间以吸收撞击声的隔音材料。"
    }
  ],
  "aiQuality": {
    "locationErrors": 1
  }
}