{
  "id": "cd2ccec133",
  "date": "2026-08-19",
  "title": "2026年广东省党外人士暑期座谈会召开",
  "source": "news.dayoo.com",
  "url": "https://news.dayoo.com/guangdong/202608/19/139996_54992306.htm",
  "pubDate": "",
  "fetchedAt": "2026-08-19T22:22:21+00:00",
  "status": "ok",
  "paragraphs": [
    "大洋网讯 8月18日上午，2026年广东省党外人士暑期座谈会在广州召开，通报我省今年以来经济工作，听取各民主党派省委会主委、省工商联主要负责人和无党派人士代表的意见建议。省委书记黄坤明主持会议并讲话，强调要深入学习贯彻习近平总书记在庆祝中国共产党成立105周年大会、中共中央党外人士座谈会上的重要讲话和对广东系列重要讲话重要指示精神，进一步凝聚共识、汇聚力量，更加有力有效做好广东各项工作，奋力实现“十五五”良好开局。省委副书记、省长孟凡利通报我省今年以来经济形势和下一步工作安排，省政协主席林克庆出席会议。",
    "会上，民革省委会主委程萍、民盟省委会主委王学成、民建省委会主委李心、民进省委会主委鲁修禄、农工党省委会主委阎武、致公党省委会主委黄武、九三学社省委会主委张少康、台盟省委会主委张嘉极、省工商联主席陈志列、无党派人士代表周万雄先后发言，结合前期调研和工作实际，聚焦我省“十五五”时期纵深推进粤港澳大湾区建设、深化实施“百县千镇万村高质量发展工程”、培育发展智能经济、强化科技创新能力、加强未来产业前瞻布局、促进传统产业转型升级、助力外贸扩容提质、提升人才培养质效等主题发言，分享认识体会，提出意见建议。",
    "黄坤明充分肯定过去一年省各民主党派、工商联、无党派人士为推动广东高质量发展、现代化建设作出的新贡献。他指出，今年是中国共产党成立105周年、红军长征胜利90周年，在长期的革命、建设、改革实践中，中国共产党同各民主党派风雨同舟、共同奋斗，形成了久经考验、肝胆相照的亲密友党关系，携手创造了中国共产党领导的多党合作和政治协商制度。历史和实践充分证明，这一新型政党制度蕴含着鲜明的人民属性，充分体现了社会主义民主政治本质；这一新型政党制度坚持大团结大联合，能够最大程度团结一切可以团结的力量；这一新型政党制度发扬民主、集思广益，极大提升了治国理政的科学性、有效性。我们必须倍加珍惜、长期坚持，将之贯彻落实到推进“十五五”时期广东现代化建设的实践中，充分彰显其不可比拟的优越性和强大生命力。",
    "黄坤明指出，习近平总书记近期在中共中央政治局会议、党外人士座谈会上发表重要讲话，深入分析当前经济形势，明确提出下半年经济工作重点任务，对党外人士发挥优势凝心聚力提出殷切希望。省各民主党派、工商联、无党派人士要深入学习好贯彻好，把思想和行动统一到总书记、中共中央关于经济形势的分析研判和对经济工作的决策部署上来，深刻认识广东上半年经济运行平稳健康、符合预期，向好因素不断积累，完成全年目标任务有支撑、有底气，同时清醒看到当前机遇与挑战并存，进一步坚定信心、迎难而上，协助做好解疑释惑、凝聚共识工作，广泛深入基层一线、企业现场调查研究，针对性提出意见建议，充分调动各方面投身经济建设主战场的积极性主动性创造性，共同推动广东经济社会平稳健康发展。",
    "黄坤明指出，实现习近平总书记赋予的“走在前、作示范、挑大梁”的使命任务，推动广东“十五五”时期经济社会发展目标任务落地落实，需要省各民主党派、工商联和无党派人士充分发挥优势，在参政议政、建言献策，反映民意、发动群众，投身参与、民主监督等方面发挥重要作用，齐心协力开创广东现代化建设新局面。希望大家聚焦粤港澳大湾区建设积极履职尽责，围绕做实“一点两地”全新定位，着眼深化三地“硬联通”“软联通”“心联通”，在打造多层次、全方位、立体化合作格局上发挥更大作用，推动粤港澳三地五年规划深度对接、重点工作同频共振，携手打造国际一流湾区和世界级城市群。聚焦经济高质量发展积极履职尽责，在聚力科研攻关、牵线成果转化、引导推广应用等方面发挥更大作用，深度参与和支持广东智能经济发展，助力发展新质生产力，加快我省现代化产业体系建设。聚焦“百千万工程”积极履职尽责，汇聚力量打造更多品牌活动、标志项目，踊跃投身绿美广东生态建设和海洋强省建设，促进广大县镇村在特色发展、集聚发展、融合发展中脱胎换骨、焕然一新，向着“五年显著变化”目标迈进。聚焦保障和改善民生积极履职尽责，更多关心关怀一线工作者，调动和发挥职工群众的积极性主动性，深入了解就业、教育、医疗、养老、托幼、住房等民生实情和基层首创经验，协助做好理顺情绪、化解矛盾、维护稳定、法治建设等工作，为保障人民群众安心、安居、安业共同努力。",
    "黄坤明强调，省各民主党派和工商联要加强自身建设，始终把坚持中国共产党领导作为首要原则，坚持不懈用习近平新时代中国特色社会主义思想凝心铸魂，继承和发扬多党合作优良传统，深化政治交接，强化组织建设，提升履职能力，严肃纪律作风，接续推动我省多党合作事业再上新台阶。中共广东省委将坚定不移加强对统一战线工作的领导，毫不动摇坚持好落实好中国新型政党制度，一如既往全力支持各民主党派、工商联、无党派人士履职尽责、开展工作。",
    "省领导王曦，省委办公厅、省委统战部有关负责同志，各民主党派省委会在穗领导班子成员及秘书长，省工商联主要负责人、无党派人士代表参加会议。"
  ],
  "keySentences": [],
  "aiModel": "deepseek-chat",
  "aiPromptVersion": "article-analysis-v1",
  "aiGeneratedAt": "2026-08-19T22:22:23+00:00",
  "sourceTextHash": "0fec5a3ba9c7eb63134ddaeb014b8938dd061f2d0710dc671cabea397609c8e0",
  "aiStatus": "ok",
  "aiSummary": "8月18日，2026年广东省党外人士暑期座谈会在广州召开，省委书记黄坤明主持并讲话，强调凝聚共识，听取各民主党派等意见建议，聚焦粤港澳大湾区建设、百千万工程等，推动广东“十五五”良好开局。",
  "aiAnnotations": [
    {
      "id": "ai-0-167-208-viewpoint",
      "paragraphIndex": 0,
      "start": 167,
      "end": 208,
      "text": "进一步凝聚共识、汇聚力量，更加有力有效做好广东各项工作，奋力实现“十五五”良好开局",
      "type": "viewpoint"
    },
    {
      "id": "ai-2-173-207-viewpoint",
      "paragraphIndex": 2,
      "start": 173,
      "end": 207,
      "text": "这一新型政党制度蕴含着鲜明的人民属性，充分体现了社会主义民主政治本质",
      "type": "viewpoint"
    },
    {
      "id": "ai-3-155-202-viewpoint",
      "paragraphIndex": 3,
      "start": 155,
      "end": 202,
      "text": "深刻认识广东上半年经济运行平稳健康、符合预期，向好因素不断积累，完成全年目标任务有支撑、有底气",
      "type": "viewpoint"
    },
    {
      "id": "ai-4-148-179-viewpoint",
      "paragraphIndex": 4,
      "start": 148,
      "end": 179,
      "text": "聚焦粤港澳大湾区建设积极履职尽责，围绕做实“一点两地”全新定位",
      "type": "viewpoint"
    },
    {
      "id": "ai-0-5-12-exam_point",
      "paragraphIndex": 0,
      "start": 5,
      "end": 12,
      "text": "8月18日上午",
      "type": "exam_point"
    },
    {
      "id": "ai-0-13-30-exam_point",
      "paragraphIndex": 0,
      "start": 13,
      "end": 30,
      "text": "2026年广东省党外人士暑期座谈会",
      "type": "exam_point"
    },
    {
      "id": "ai-0-89-92-exam_point",
      "paragraphIndex": 0,
      "start": 89,
      "end": 92,
      "text": "黄坤明",
      "type": "exam_point"
    },
    {
      "id": "ai-0-217-220-exam_point",
      "paragraphIndex": 0,
      "start": 217,
      "end": 220,
      "text": "孟凡利",
      "type": "exam_point"
    },
    {
      "id": "ai-1-157-170-exam_point",
      "paragraphIndex": 1,
      "start": 157,
      "end": 170,
      "text": "百县千镇万村高质量发展工程",
      "type": "exam_point"
    },
    {
      "id": "ai-2-143-162-exam_point",
      "paragraphIndex": 2,
      "start": 143,
      "end": 162,
      "text": "中国共产党领导的多党合作和政治协商制度",
      "type": "exam_point"
    },
    {
      "id": "ai-4-170-174-term",
      "paragraphIndex": 4,
      "start": 170,
      "end": 174,
      "text": "一点两地",
      "type": "term",
      "explanation": "指粤港澳大湾区建设中广东的定位，即“新发展格局的战略支点、高质量发展的示范地、中国式现代化的引领地”。"
    }
  ],
  "aiQuality": {
    "locationErrors": 0
  }
}