{
  "id": "66f175839d",
  "date": "2026-08-18",
  "title": "前7月广东省离境退税申请金额16.9亿元",
  "source": "news.dayoo.com",
  "url": "https://news.dayoo.com/guangdong/202608/18/139996_54992074.htm",
  "pubDate": "",
  "fetchedAt": "2026-08-18T22:21:46+00:00",
  "status": "ok",
  "paragraphs": [
    "8月18日，记者从海关总署广东分署了解到，1—7月，广东省内海关合计验核离境退税申请18.6万票，验核申请单金额16.9亿元，同比分别增长6.4倍、1.2倍。电子产品和服装成为旅客申请离境退税的热门商品。",
    "自7月1日小额抽检、无纸化办理新政实施以来，广东省内海关协同发力，细化服务举措、强化部门联动，推动离境退税新政在全省平稳落地，政策红利持续释放。",
    "广州海关所属广州白云机场海关关员在出境申报台为出境旅客办理离境退税验核业务",
    "据介绍，“小额抽检”是指海关对退税销售额1万元以下的退税申请单不再逐单开展实物验核，只实行按比例随机抽检的监管方式。7月全省新增3个离境退税口岸4个验核服务点，全省合计13个口岸可提供离境退税验核服务，叠加新政实施，境外旅客购物离境意愿增强，获得感稳步提升。单7月，海关共办理离境退税验核业务2.7万票，验核申请单金额2.6亿元，环比6月分别增长4.2%、1.8%。",
    "为推动新政作用充分发挥，省内各关立足口岸实际优化服务供给。广州海关聚焦空港通关场景，在出境重点区域增设多语种宣传指引，配备可翻译120余种语言的实时交流设备，依托可视化远程验核终端实现前后台联动作业，验核效率提升30%；深化与边检、税务、机场航服协同，推行“一单一包”（指商店使用标准密封袋将退税商品统一打包，并与退税申请单一一对应，海关验核密封袋完整性及对应单据，确认无误后快速验放）便利模式，提前做好新政宣讲和应急演练，动态调配高峰时段人力，妥善处置现场业务问题，保障旅客顺利离境。",
    "深圳海关构建海陆空全覆盖的离境退税口岸布局，6个离境退税口岸，数量位居全国前列；依托无纸化新政压缩通关时长，小额抽检最快20秒办结，结合APEC“中国年”通关保障，持续提升旅客通关感受。拱北海关加快口岸退税服务点布局，目前关区5个服务点覆盖4个口岸；联合地方部门开展多场政策宣讲，在横琴创新“一单一包”监管模式，落实免拆封快速通关，打通多部门数据链路，构建全流程闭环监管体系。",
    "海关总署广东分署有关负责人表示，下一步海关将持续跟踪新政运行态势，优化通关服务，深化跨部门协同，充分释放离境退税政策效能，助力打造对外开放消费新高地。",
    "文/广州日报新花城记者：林琳 通讯员：陈琳、潘婉雯"
  ],
  "keySentences": [],
  "aiModel": "deepseek-chat",
  "aiPromptVersion": "article-analysis-v1",
  "aiGeneratedAt": "2026-08-18T22:21:48+00:00",
  "sourceTextHash": "32207202359407f3b22e13ef9d64466de9a2ca00ef54be74a90b14f97bc8f391",
  "aiStatus": "ok",
  "aiSummary": "今年1至7月，广东省离境退税申请金额达16.9亿元，同比增长1.2倍。小额抽检和无纸化新政实施后，退税办理效率提升，口岸服务点增加，境外旅客购物离境意愿增强，政策红利持续释放。",
  "aiAnnotations": [
    {
      "id": "ai-0-21-78-viewpoint",
      "paragraphIndex": 0,
      "start": 21,
      "end": 78,
      "text": "1—7月，广东省内海关合计验核离境退税申请18.6万票，验核申请单金额16.9亿元，同比分别增长6.4倍、1.2倍",
      "type": "viewpoint"
    },
    {
      "id": "ai-1-0-71-viewpoint",
      "paragraphIndex": 1,
      "start": 0,
      "end": 71,
      "text": "自7月1日小额抽检、无纸化办理新政实施以来，广东省内海关协同发力，细化服务举措、强化部门联动，推动离境退税新政在全省平稳落地，政策红利持续释放",
      "type": "viewpoint"
    },
    {
      "id": "ai-3-4-57-term",
      "paragraphIndex": 3,
      "start": 4,
      "end": 57,
      "text": "“小额抽检”是指海关对退税销售额1万元以下的退税申请单不再逐单开展实物验核，只实行按比例随机抽检的监管方式",
      "type": "term",
      "explanation": "海关对低额退税单按比例随机抽检，不再逐单实物验核，以提高通关效率。"
    },
    {
      "id": "ai-3-58-100-exam_point",
      "paragraphIndex": 3,
      "start": 58,
      "end": 100,
      "text": "7月全省新增3个离境退税口岸4个验核服务点，全省合计13个口岸可提供离境退税验核服务",
      "type": "exam_point"
    },
    {
      "id": "ai-3-129-182-exam_point",
      "paragraphIndex": 3,
      "start": 129,
      "end": 182,
      "text": "单7月，海关共办理离境退税验核业务2.7万票，验核申请单金额2.6亿元，环比6月分别增长4.2%、1.8%",
      "type": "exam_point"
    },
    {
      "id": "ai-4-59-78-exam_point",
      "paragraphIndex": 4,
      "start": 59,
      "end": 78,
      "text": "配备可翻译120余种语言的实时交流设备",
      "type": "exam_point"
    },
    {
      "id": "ai-4-100-109-exam_point",
      "paragraphIndex": 4,
      "start": 100,
      "end": 109,
      "text": "验核效率提升30%",
      "type": "exam_point"
    },
    {
      "id": "ai-4-128-134-term",
      "paragraphIndex": 4,
      "start": 128,
      "end": 134,
      "text": "“一单一包”",
      "type": "term",
      "explanation": "商店将退税商品统一密封打包，与退税申请单对应，海关验核密封袋完整性后快速放行。"
    },
    {
      "id": "ai-5-0-39-viewpoint",
      "paragraphIndex": 5,
      "start": 0,
      "end": 39,
      "text": "深圳海关构建海陆空全覆盖的离境退税口岸布局，6个离境退税口岸，数量位居全国前列",
      "type": "viewpoint"
    },
    {
      "id": "ai-5-54-65-exam_point",
      "paragraphIndex": 5,
      "start": 54,
      "end": 65,
      "text": "小额抽检最快20秒办结",
      "type": "exam_point"
    },
    {
      "id": "ai-5-93-124-exam_point",
      "paragraphIndex": 5,
      "start": 93,
      "end": 124,
      "text": "拱北海关加快口岸退税服务点布局，目前关区5个服务点覆盖4个口岸",
      "type": "exam_point"
    },
    {
      "id": "ai-6-16-74-viewpoint",
      "paragraphIndex": 6,
      "start": 16,
      "end": 74,
      "text": "下一步海关将持续跟踪新政运行态势，优化通关服务，深化跨部门协同，充分释放离境退税政策效能，助力打造对外开放消费新高地",
      "type": "viewpoint"
    }
  ],
  "aiQuality": {
    "locationErrors": 0
  }
}