{
  "id": "8f1f3ac68f",
  "date": "2026-08-14",
  "title": "江苏省人民政府 要闻关注 刘小涛会见中金公司董事长陈亮",
  "source": "中国政府网",
  "url": "http://www.jiangsu.gov.cn/art/2026/8/14/art_84322_11816136.html",
  "pubDate": "",
  "fetchedAt": "2026-08-14T22:11:24+00:00",
  "status": "ok",
  "paragraphs": [
    "8月12日，省长刘小涛在南京会见中国国际金融股份有限公司董事长陈亮。",
    "刘小涛对陈亮一行表示欢迎。他说，江苏正加快培育发展新质生产力、促进科技创新和产业创新深度融合，需要更大力度的多层次、专业化金融赋能。希望中金公司发挥全球资源优势，充分链接国际主权基金、顶尖投资机构和长期耐心资本，聚焦新兴支柱产业和未来产业提供全方位、定制化综合金融服务，引导更多优质科创项目落地，进一步提升江苏资本市场的集聚效应和核心能级。我们将持续优化投融资生态，携手搭建精准对接平台，共同提升金融服务实体经济质效。",
    "陈亮表示，中金公司始终将江苏作为布局的重要区域，将围绕国家发展战略和江苏实际需求，依托丰富的国内外网络，助力壮大资本市场“江苏板块”，为江苏高质量发展注入更多金融活水。"
  ],
  "keySentences": []
}